Name,Type,Price per night,Host,Rating,Reviews,City
"Loft (45 mts2) con terraza, Rummelsburg Bay","Alojamiento entero: apto. residencial en Berlín, Alemania",84,Anfitrión: Mirco,"4,96",107,berlin
Luminoso apartamento de 3 habitaciones en Neukölln,"Alojamiento entero: apto. residencial en Berlín, Alemania",200,Anfitrión: Frederic,"5,0",9,berlin
Experimenta Berlín 2020,"Alojamiento entero: piso en Berlín, Alemania",80,Anfitrión: Sven,"4,95",37,berlin
Adorable casa de huéspedes con alberca y sauna en Pankow,"Alojamiento entero: bungalow en Berlín, Alemania",206,Anfitrión: Thomas & Susanne,"4,98",61,berlin
Apartamento privado Simon-Dach,"Alojamiento entero: apto. residencial en Berlín, Alemania",170,Anfitrión: Joana Karina,"5,0",20,berlin
Piso único en Schillerkiez,"Alojamiento entero: apto. residencial en Berlín, Alemania",141,Anfitrión: Alex,"5,0",37,berlin
Habitación tranquila en un apartamento queer Friendly,"Habitación en Berlín, Alemania",77,Quédate con Julien,"5,0",13,berlin
Apartamento estudio moderno,"Alojamiento entero: piso en Berlín, Alemania",87,Anfitrión: Vincent,"5,0",7,berlin
Vivir en el asentamiento forestal,"Alojamiento entero: apto. residencial en Blankenfelde-Mahlow, Alemania",70,Anfitrión: Petra,"5,0",22,berlin
Apartamento acogedor y tranquilo en Berlín cerca del transporte público,"Alojamiento entero: piso en Berlín, Alemania",77,Anfitrión: Anica,"4,94",100,berlin
Estudio en Prenzlauer Berg,"Alojamiento entero: piso en Berlín, Alemania",81,Anfitrión: Mostafa,,,berlin
Edificio antiguo de diseño recién reformado,"Alojamiento entero: piso en Berlín, Alemania",150,Anfitrión: Indra,"5,0",8,berlin
ACOGEDOR ALOJAMIENTO,"Alojamiento entero: piso en Berlín, Alemania",140,Anfitrión: Vera,"5,0",7,berlin
The Luxury Orchid Home,"Alojamiento entero: piso en Berlín, Alemania",249,Anfitrión: Claas,"5,0",,berlin
Soleado balcón loft en la última planta +vista Prenzlauer Berg,"Alojamiento entero: loft en Berlín, Alemania",139,Anfitrión: Claus,"4,90",185,berlin
La mejor ubicación: Precioso apartamento en Friedrichshain,"Alojamiento entero: piso en Berlín, Alemania",81,Anfitrión: David,"4,94",,berlin
Apartamento recién renovado en el Castillo de Charlottenburg,"Alojamiento entero: piso en Berlín, Alemania",100,Anfitrión: Heiko,"4,94",162,berlin
Tranquilo apartamento estudio cerca del Mauerpark,"Alojamiento entero: apto. residencial en Berlín, Alemania",89,Anfitrión: Atto,"4,97",143,berlin
Apartamento tranquilo en la casa sueca en medio de Berlín,"Alojamiento entero: apto. residencial en Berlín, Alemania",112,Anfitrión: Anke,"4,97",140,berlin
Apartamento de ensueño en Central Place /Privat Parking,"Alojamiento entero: loft en Berlín, Alemania",211,Anfitrión: Mikel,"4,95",60,berlin
Tranquilo apartamento estudio cerca del Mauerpark,"Alojamiento entero: apto. residencial en Berlín, Alemania",89,Anfitrión: Atto,"4,97",143,berlin
Apartamento estudio elegante y moderno en Berlín-Charlottenburg,"Alojamiento entero: piso en Berlín, Alemania",115,Anfitrión: Sandra,"4,66",44,berlin
Apartamento de 2 habitaciones - muy céntrico - Superview Mitte,"Alojamiento entero: apto. residencial en Berlín, Alemania",88,Anfitrión: Regina,"4,94",35,berlin
Elegante escondite en el corazón de Berlín.,"Alojamiento entero: apto. residencial en Berlín, Alemania",213,Anfitrión: Michaela,"4,94",31,berlin
"Amplio, mejor ubicación, 2 balcones, moderno!","Alojamiento entero: piso en Berlín, Alemania",249,Anfitrión: Kolja,"4,93",28,berlin
Con estilo en Berlín,"Alojamiento entero: apto. residencial en Berlín, Alemania",174,Anfitrión: Paolo Maria,"4,96",28,berlin
Piso urbano de Kreuzberg con balcón en el patio,"Alojamiento entero: apto. residencial en Berlín, Alemania",137,Anfitrión: Andreas,"4,89",267,berlin
Los oasis urbanos junto al agua,"Alojamiento entero: apto. residencial en Berlín, Alemania",110,Anfitrión: Anjeza,"5,0",10,berlin
Über den Dächern von Berlin,"Alojamiento entero: apto. residencial en Berlín, Alemania",65,Anfitrión: Norbert,"4,98",40,berlin
Apartamento en Berlín-Adlershof,"Alojamiento entero: piso en Berlín, Alemania",89,Anfitrión: Hanna,"4,91",32,berlin
Apartamento en un edificio antiguo en Alt-Treptow,"Alojamiento entero: piso en Berlín, Alemania",150,Anfitrión: Uwe,"5,0",15,berlin
Acogedor apartamento en Maisonette cerca de KuDamm,"Alojamiento entero: piso en Berlín, Alemania",119,Anfitrión: Flo Und Friedl,,,berlin
Habitación privada en lujo. Apartamento limpio de 330 m² + sauna.,"Habitación en Berlín, Alemania",84,Quédate con Freddy,"4,97",31,berlin
En el corazón de Neuköllner Kiez ;)Real Berlin Feeling!,"Alojamiento entero: piso en Berlín, Alemania",95,Anfitrión: Villiam,"5,0",10,berlin
Acogedor apartamento en Sprengelkiez - Berlín,"Alojamiento entero: apto. residencial en Berlín, Alemania",90,Anfitrión: Guillaume,"4,88",8,berlin
Acogedora maisonette en el centro de Berlín,"Alojamiento entero: piso en Berlín, Alemania",90,Anfitrión: Ursula,,,berlin
Departamento Boutique Ruhiges,"Alojamiento entero: piso en Berlín, Alemania",70,Anfitrión: Mathias,"4,89",9,berlin
En una zona de moda con carácter,"Alojamiento entero: piso en Berlín, Alemania",118,Anfitrión: Victor,"5,0",,berlin
Elegante apartamento de 70 m2 en el centro de Berlín (Mitte),"Alojamiento entero: apto. residencial en Berlín, Alemania",110,Anfitrión: Sabine,"4,92",,berlin
¡Acogedor apartamento en el corazón de la zona más moderna!,"Alojamiento entero: apto. residencial en Berlín, Alemania",120,Anfitrión: Artemis- Diana,"5,0",6,berlin
Bright + green *15 min to Potsdamer Platz*,"Alojamiento entero: apto. residencial en Berlín, Alemania",71,Anfitrión: Ansgar,"4,67",3,berlin
Apartamento ejecutivo de 110 metros cuadrados cerca de Museumsinsel,"Alojamiento entero: piso en Berlín, Alemania",140,Anfitrión: Christian,"5,0",3,berlin
Apartamento Urbanes en F-Hain,"Alojamiento entero: piso en Berlín, Alemania",86,Anfitrión: Ria,"4,91",11,berlin
apartamento acogedor en friedrichshain,"Alojamiento entero: piso en Berlín, Alemania",104,Anfitrión: Fatoş,,,berlin
204 * El mejor lugar para estar en el centro de la ciudad *,"Alojamiento entero: piso en Berlín, Alemania",264,Anfitrión: Douglas,,,berlin
Hermosa habitación junto al canal (Gräfekiez),"Habitación en Berlín, Alemania",55,Anfitrión: Katja,"4,92",403,berlin
Acogedor ático con vistas únicas sobre la ciudad,"Alojamiento entero: apto. residencial en Berlín, Alemania",265,Anfitrión: Vasil,"4,96",26,berlin
Acogedora habitación con baño adjunto cerca de Mauerpark,"Habitación en Berlín, Alemania",65,Quédate con Dave,"4,94",78,berlin
"504 * El lugar para estar en la mejor zona, reformado","Alojamiento entero: piso en Berlín, Alemania",245,Anfitrión: Douglas,"5,0",9,berlin
Apartamento estudio en Berlín Mitte,"Alojamiento entero: piso en Berlín, Alemania",92,Anfitrión: Dominik,"5,0",31,berlin
"Maisonette, la mejor ubicación de 2 balcones de Berlín-Mitte","Alojamiento entero: piso en Berlín, Alemania",141,Anfitrión: Marisa,"4,98",81,berlin
Penthouse de lujo en el corazón de Berlín,"Alojamiento entero: piso en Berlín, Alemania",231,Anfitrión: Stefania,"5,0",21,berlin
Maisonette en la planta superior del corazón de Berlín,"Alojamiento entero: piso en Berlín, Alemania",170,Anfitrión: Stephan,"4,96",27,berlin
Pequeña casa a las afueras del pueblo,"Alojamiento entero: bungalow en Falkensee, Alemania",99,Anfitrión: Celina,,,berlin
"Estudio único y tranquilo, excelente ubicación!","Alojamiento entero: piso en Berlín, Alemania",104,Anfitrión: Alexander,"4,96",74,berlin
Acogedora casa en el maravilloso distrito de Friedrichshain,"Alojamiento entero: piso en Berlín, Alemania",284,Anfitrión: Sonya,"5,0",22,berlin
Apartamento ejecutivo de 110 metros cuadrados cerca de Museumsinsel,"Alojamiento entero: piso en Berlín, Alemania",140,Anfitrión: Christian,"5,0",3,berlin
Berlín puro:elegante neu2 Zi/Terrasse/Zentrum/Mauer,"Alojamiento entero: apartamento con servicios en Berlín, Alemania",238,Anfitrión: Kathrin,"4,94",52,berlin
Maisonette en la planta superior del corazón de Berlín,"Alojamiento entero: piso en Berlín, Alemania",170,Anfitrión: Stephan,"4,96",27,berlin
"504 * El lugar para estar en la mejor zona, reformado","Alojamiento entero: piso en Berlín, Alemania",245,Anfitrión: Douglas,"5,0",9,berlin
Apartamento de lujo en Frankfurter Allee,"Alojamiento entero: piso en Berlín, Alemania",141,Anfitrión: Flo,,,berlin
Elegante oasis en el corazón de Berlín,"Alojamiento entero: piso en Berlín, Alemania",121,Anfitrión: Sacha,"4,88",24,berlin
Estudio de artista en Berlín - Prenzlauer Berg,"Alojamiento entero: loft en Berlín, Alemania",120,Anfitrión: Georg,"4,91",22,berlin
Penthouse de lujo en el corazón de Berlín,"Alojamiento entero: piso en Berlín, Alemania",231,Anfitrión: Stefania,"5,0",21,berlin
estudio luminoso en Schöneberg junto a la ciudad de Berlín,"Alojamiento entero: piso en Berlín, Alemania",137,Anfitrión: Jens,"4,90",217,berlin
Acogedora habitación con baño adjunto cerca de Mauerpark,"Habitación en Berlín, Alemania",65,Quédate con Dave,"4,94",78,berlin
"Waldrand Tiergarten: céntrico, moderno, cómodo","Alojamiento entero: piso en Berlín, Alemania",105,Anfitrión: Katja,"4,96",46,berlin
Hermosa habitación junto al canal (Gräfekiez),"Habitación en Berlín, Alemania",55,Anfitrión: Katja,"4,92",403,berlin
Karo: un oasis de paz en Kreuzberg,"Alojamiento entero: piso en Berlín, Alemania",86,Anfitrión: Jan,"4,92",157,berlin
TempelCasa,"Alojamiento entero: apto. residencial en Berlín, Alemania",97,Anfitrión: Alexander,"4,88",240,berlin
Estudio creativo en Friedrichshain-Boxhagener Platz,"Alojamiento entero: piso en Berlín, Alemania",120,Anfitrión: Claudia,"4,94",36,berlin
"Mucho espacio, dentro del anillo","Habitación en Berlín, Alemania",82,Quédate con Christof,"5,0",3,berlin
"Maisonette, la mejor ubicación de 2 balcones de Berlín-Mitte","Alojamiento entero: piso en Berlín, Alemania",141,Anfitrión: Marisa,"4,98",81,berlin
#505 Sé mi huésped,"Alojamiento entero: apartamento con servicios en Berlín, Alemania",106,Anfitrión: Apartmently,"4,82",76,berlin
Estudio creativo en Friedrichshain-Boxhagener Platz,"Alojamiento entero: piso en Berlín, Alemania",120,Anfitrión: Claudia,"4,94",36,berlin
moderno y céntrico estudio cerca de Alexanderplatz,"Alojamiento entero: piso en Berlín, Alemania",115,Anfitrión: Julian,"4,82",324,berlin
SMARTments - Vida temporal en Prenzlauer Berg,"Alojamiento entero: apartamento con servicios en Berlín, Alemania",95,Anfitrión: SMARTments,,,berlin
UN GRAN ÁTICO,"Alojamiento entero: loft en Berlín, Alemania",155,Anfitrión: Jeep,"4,84",132,berlin
Acogedora habitación con baño adjunto cerca de Mauerpark,"Habitación en Berlín, Alemania",65,Quédate con Dave,"4,94",78,berlin
Apartamento de lujo con carácter en Berlín Kreuzberg-1,"Alojamiento entero: piso en Berlín, Alemania",129,Anfitrión: Tuncay,"5,0",5,berlin
,"Alojamiento entero: casa de invitados en Teltow, Alemania",84,Anfitrión: Harald,"4,97",37,berlin
Departamento nuevo accesible,"Alojamiento entero: piso en Berlín, Alemania",149,Anfitrión: Tobias,"4,93",,berlin
Hermosa habitación junto al canal (Gräfekiez),"Habitación en Berlín, Alemania",55,Anfitrión: Katja,"4,92",403,berlin
"Precioso loft, balcón y baño propio","Habitación privada en: loft en Berlín, Alemania",71,Anfitrión: Theresa,"4,81",,berlin
"Maisonette, la mejor ubicación de 2 balcones de Berlín-Mitte","Alojamiento entero: piso en Berlín, Alemania",141,Anfitrión: Marisa,"4,98",81,berlin
Industrial-Design Loft de 100 metros cuadrados en Friedrichshain,"Alojamiento entero: loft en Berlín, Alemania",240,Anfitrión: Lorant,"4,92",89,berlin
apartamento acogedor en friedrichshain,"Alojamiento entero: piso en Berlín, Alemania",104,Anfitrión: Fatoş,,,berlin
2032 * Acogedor apartamento en el corazón de Berlín,"Alojamiento entero: piso en Berlín, Alemania",232,Anfitrión: Douglas,,,berlin
"Estudio único y tranquilo, excelente ubicación!","Alojamiento entero: piso en Berlín, Alemania",104,Anfitrión: Alexander,"4,96",74,berlin
Estudio de 60 metros cuadrados en el parque Gleisdreieck,"Alojamiento entero: piso en Berlín, Alemania",150,Anfitrión: Guillermo,,,berlin
Cervecería renovada en un lago,"Alojamiento entero: piso en Berlín, Alemania",120,Anfitrión: Dani,,,berlin
Apartamento acogedor autónomo,"Alojamiento entero: vivienda en Berlín, Alemania",86,Anfitrión: Iulia,"5,0",11,berlin
viajar con un perro no es ningún problema con nosotros,"Alojamiento entero: piso en Schulzendorf, Alemania",72,Anfitrión: R,"5,0",4,berlin
"Mucho espacio, dentro del anillo","Habitación en Berlín, Alemania",82,Quédate con Christof,"5,0",3,berlin
"FU-Zentral, hermosa parte/departamento en renovado.20er Ja","Alojamiento entero: piso en Berlín, Alemania",110,Anfitrión: Nina,"4,93",134,berlin
CASA DE CAMPO EN EL CINTURÓN DE TOCINO DE BERLÍN,"Alojamiento entero: vivienda en Schönwalde-Glien, Alemania",78,Anfitrión: Margit,"4,99",142,berlin
Fantástico apartamento en el ático,"Alojamiento entero: apto. residencial en Berlín, Alemania",130,Anfitrión: Anna,,,berlin
Departamento de Diseño Prenzlauer Berg,"Alojamiento entero: piso en Berlín, Alemania",100,Anfitrión: Maycon & Christian,"4,94",83,berlin
Hermoso ático / ático con terraza,"Alojamiento entero: piso en Berlín, Alemania",149,Anfitrión: Anna & Robin,"4,98",43,berlin
La joya de Neukölln,"Alojamiento entero: piso en Berlín, Alemania",77,Anfitrión: Malte,"4,94",16,berlin
"Apartamento tranquilo de 1 habitación en el parque, a 20 minutos del centro","Alojamiento entero: piso en Berlín, Alemania",80,Anfitrión: Anne,,,berlin
2021 * Apartamento urbano en el centro de la ciudad,"Alojamiento entero: piso en Berlín, Alemania",249,Anfitrión: Douglas,,,berlin
Moderno apartamento de edificio antiguo en Charlottenburg,"Alojamiento entero: piso en Berlín, Alemania",125,Anfitrión: Lorenz J.,"4,91",,berlin
Elegante y acogedora casa de huéspedes con terraza y piscina,"Alojamiento entero: casa de invitados en Berlín, Alemania",90,Anfitrión: Yannik,"4,99",67,berlin
Sueño para parejas: habitación en el corazón de Kreuzberg,"Habitación en Berlín, Alemania",120,Anfitrión: Cem,"4,96",193,berlin
Edificio moderno con jardín vertical y 2 recamaras,"Alojamiento entero: apto. residencial en Berlín, Alemania",225,Anfitrión: Tomasz,"4,98",112,berlin
Departamento nuevo en Schönefeld,"Alojamiento entero: piso en Schönefeld, Alemania",92,Anfitrión: Frank,,,berlin
Paraíso en madera,"Alojamiento entero: piso en Berlín, Alemania",68,Anfitrión: Paul,,,berlin
EXCELENTE apartamento de 102 * en el centro de la ciudad,"Alojamiento entero: piso en Berlín, Alemania",174,Anfitrión: Douglas,,,berlin
Habitación de huéspedes balneoterapia Limeil-Brévannes,"Habitación privada en: bed and breakfast en Limeil-Brévannes, Francia",186,Anfitrión: Stephane,"5,0",34,paris
"Casa Nina, Suite de excepción","Alojamiento entero: vivienda en L'Île-Saint-Denis, Francia",379,Anfitrión: Maison,"4,94",196,paris
Estudio en la calle la Boëtie,"Alojamiento entero: piso en París, Francia",100,Anfitrión: Priscille,,,paris
Acogedor apartamento * Puertas de París * Pareja ideal,"Alojamiento entero: piso en Gentilly, Francia",89,Anfitrión: Fanny,"5,0",,paris
2 habitaciones en París - Campos de Marte/Torre Eiffel,"Alojamiento entero: piso en París, Francia",130,Anfitrión: Valentine,,,paris
Estudio con encanto bien situado,"Alojamiento entero: piso en París, Francia",86,Anfitrión: Marie,"4,83",,paris
Apartamento luminoso con vistas a los tejados,"Alojamiento entero: piso en París, Francia",86,Anfitrión: Valentin,,,paris
¡Sol en el corazón de Le Marais!,"Alojamiento entero: piso en París, Francia",300,Anfitrión: Illi,,,paris
Appart Paris16 Tour Eiffel Troca,"Alojamiento entero: piso en París, Francia",250,Anfitrión: Simon,,,paris
La mejor vista de la torre Eiffel.,"Alojamiento entero: piso en París, Francia",240,Anfitrión: Jeanne,,,paris
Elegante art deco a pie de París 16.,"Alojamiento entero: piso en París, Francia",265,Anfitrión: Miles,"5,0",20,paris
Amplio apartamento de 2 habitaciones con terraza,"Alojamiento entero: piso en París, Francia",130,Anfitrión: Thierry,"4,92",62,paris
Encantador estudio en un barrio animado,"Alojamiento entero: piso en París, Francia",110,Anfitrión: Rodolphe,"4,97",174,paris
Encanto de 2 habitaciones Montmartre,"Alojamiento entero: piso en París, Francia",99,Anfitrión: Alban,,,paris
Precioso apartamento en Le Marais,"Alojamiento entero: piso en París, Francia",,Anfitrión: Steeve,,,paris
Encanto y comodidad en el corazón de Batignolles,"Alojamiento entero: piso en París, Francia",210,Anfitrión: Clément,"4,94",18,paris
Balcón | en el corazón del distrito 9,"Alojamiento entero: piso en París, Francia",164,Anfitrión: Julian,,,paris
Apartamento tranquilo en Montmartre - EasyHostin',"Alojamiento entero: piso en París, Francia",179,Anfitrión: Samuel,"5,0",9,paris
Apartamento tranquilo en Montmartre - EasyHostin',"Alojamiento entero: piso en París, Francia",179,Anfitrión: Samuel,"5,0",9,paris
Edgar Suites Bouchardon - Studio superior patio,"Alojamiento entero: piso en París, Francia",308,Anfitrión: Edgar,"4,96",24,paris
Encantador apartamento - Canal St Martin/République,"Alojamiento entero: piso en París, Francia",140,Anfitrión: Thibault,"4,98",,paris
Apartamento tranquilo Abbesses Montmartre,"Alojamiento entero: piso en París, Francia",145,Anfitrión: Benoit,"5,0",17,paris
Increíble apartamento en Montmartre 2/4P,"Alojamiento entero: piso en París, Francia",138,Anfitrión: Anthony,"5,0",,paris
Le Van Gogh Appart • 3'RER • 11'Paris • 23'Disney,"Alojamiento entero: piso en Bry-sur-Marne, Francia",110,Anfitrión: Ornella,"4,97",29,paris
Ático Sky cerca de la torre Eiffel,"Habitación privada en: piso en París, Francia",280,Anfitrión: Mickael,"4,90",230,paris
Joie Paris Poliveau,"Alojamiento entero: piso en París, Francia",,Anfitrión: Joie Paris,,,paris
Acogedor apartamento para 2 -canal st Martin,"Alojamiento entero: piso en París, Francia",87,Anfitrión: Alexia,"3,67",3,paris
Gran apartamento acogedor a orillas del canal,"Alojamiento entero: piso en París, Francia",180,Anfitrión: Quentin,"4,94",17,paris
Un increíble 1-Br/1BA en Montmartre,"Alojamiento entero: piso en París, Francia",168,Anfitrión: Eunice,,,paris
Lac du Panorama* cerca de París* aparcamiento privado *,"Alojamiento entero: piso en Clamart, Francia",140,Anfitrión: Wahab,"5,0",,paris
Impresionante apartamento de lujo moderno y reformado,"Alojamiento entero: piso en París, Francia",191,Anfitrión: Jean-Christophe,"5,0",4,paris
Escapada a la selva bajo el cielo parisino,"Alojamiento entero: piso en París, Francia",152,Anfitrión: Tam,"5,0",3,paris
Lujoso Apartamento Jacuzzi cerca de París,"Alojamiento entero: piso en La Celle-Saint-Cloud, Francia",128,Anfitrión: Sadia,"5,0",17,paris
Apartamento T3 cerca de Montmartre,"Alojamiento entero: piso en París, Francia",190,Anfitrión: Doriane,"5,0",3,paris
Apto. 40M² Torre Eiffel - Puerta Versalles,"Alojamiento entero: piso en París, Francia",130,Anfitrión: Patricia,"4,98",87,paris
* Apartamento acogedor * Puertas de París*,"Alojamiento entero: piso en Vincennes, Francia",136,Anfitrión: Patrick,,,paris
Acogedor apartamento cerca de Rivoli y del Museo del Louvre,"Alojamiento entero: piso en París, Francia",261,Anfitrión: Checkmyguest,,,paris
Hermoso apartamento con vistas a la Torre Eiffel,"Alojamiento entero: piso en París, Francia",120,Anfitrión: Raed,,,paris
Estudio céntrico +Wifi rápido + Desayuno + Vino,"Alojamiento entero: piso en París, Francia",180,Anfitrión: Floriane,"5,0",24,paris
Magnífico Apartamento 1BR/4P - Montorgueil 6,"Alojamiento entero: piso en París, Francia",188,Anfitrión: Alex,"4,71",,paris
Encantador apartamento en el corazón de París,"Alojamiento entero: piso en París, Francia",219,Anfitrión: Checkmyguest,,,paris
Encanto parisino con vistas,"Alojamiento entero: piso en París, Francia",,Anfitrión: Cendrine,,,paris
Un increíble 1-Br/1BA en Montmartre,"Alojamiento entero: piso en París, Francia",176,Anfitrión: Eunice,,,paris
"Luminoso y tranquilo, T2 equipado a 15 minutos de París","Alojamiento entero: piso en Maisons-Alfort, Francia",67,Anfitrión: Boris,"5,0",5,paris
Encanto urbano: 2 habitaciones Acogedor cerca de Accor Arena,"Alojamiento entero: piso en París, Francia",95,Anfitrión: Manon,"5,0",8,paris
Luxury & Design Flat 1BR/4P- Bastille,"Alojamiento entero: piso en París, Francia",289,Anfitrión: Arnaud Et Sam,,,paris
Luxueux 60m² central de Beaubourg,"Alojamiento entero: piso en París, Francia",220,Anfitrión: Merci Alice,,,paris
"Montmartre Duplex, Sacré-Cœur - Charming Hideaway","Alojamiento entero: piso en París, Francia",219,Anfitrión: Joie Paris,,,paris
Loft chic vintage Paris center,"Alojamiento entero: piso en París, Francia",182,Anfitrión: Guillemette,"4,78",27,paris
Magnífico Apartamento 1BR/4P - Montorgueil 7,"Alojamiento entero: piso en París, Francia",196,Anfitrión: Alex,"4,60",,paris
Acogedor apartamento en Montmartre,"Alojamiento entero: piso en París, Francia",130,Anfitrión: Sebastien,"5,0",5,paris
Suite de 3 habitaciones en París - Nation,"Alojamiento entero: piso en París, Francia",198,Anfitrión: Walid,"5,0",29,paris
Ubicación superior - París/Disney/Montmartre,"Alojamiento entero: piso en París, Francia",160,Anfitrión: Yasmina,"4,79",14,paris
Apartamento con encanto cerca de los Quais de Seine,"Alojamiento entero: piso en París, Francia",280,Anfitrión: Checkmyguest,,,paris
Acogedor apartamento en un callejón tranquilo,"Alojamiento entero: piso en París, Francia",155,Anfitrión: Lucile,"5,0",6,paris
Apartamento de diseño con vistas a París,"Alojamiento entero: piso en París, Francia",196,Anfitrión: Damien,"5,0",31,paris
Superbe studio vue Tour Eiffel,"Alojamiento entero: piso en París, Francia",90,Anfitrión: Lisa,"5,0",17,paris
Encantador Père Lachaise de dos habitaciones,"Alojamiento entero: piso en París, Francia",120,Anfitrión: Mylene,"5,0",6,paris
"Cerca de la Torre Eiffel, metro y comercios.","Habitación en París, Francia",130,Quédate con Marine,"4,95",186,paris
Acogedora casa con terraza cerca del Canal Saint-Martin,"Alojamiento entero: piso en París, Francia",117,Anfitrión: Checkmyguest,,,paris
"En el muelle, frente al Louvre, muy limpio, buen wifi","Habitación en París, Francia",163,Anfitrión: Julia,"4,97",331,paris
Apartamento de 2 habitaciones luminoso,"Alojamiento entero: piso en París, Francia",140,Anfitrión: Annabelle,,,paris
Encantador estudio Montmartre en el último piso tranquilo,"Alojamiento entero: piso en París, Francia",95,Anfitrión: Tiphaine,,,paris
Un increíble 1-Br/1BA en Montmartre,"Alojamiento entero: piso en París, Francia",176,Anfitrión: Eunice,,,paris
Magnífico Apartamento 1BR/4P - Montorgueil 7,"Alojamiento entero: piso en París, Francia",196,Anfitrión: Alex,"4,60",,paris
París: apartamento tranquilo y luminoso,"Alojamiento entero: piso en París, Francia",115,Anfitrión: Lisa,"4,88",16,paris
Tour moderno estudio bail mobilité con vistas a Eiffel,"Alojamiento entero: piso en París, Francia",140,Anfitrión: Linda,"4,97",91,paris
Apartamento recién renovado entre la Ópera y el Louvre,"Alojamiento entero: piso en París, Francia",281,Anfitrión: Guillaume Et Penelope,"4,94",150,paris
"Boisseau, 1Ch/1Sdb, 2 personas","Alojamiento entero: piso en París, Francia",220,Anfitrión: Ludovic,,,paris
Balcón | en el corazón del distrito 9,"Alojamiento entero: piso en París, Francia",164,Anfitrión: Julian,,,paris
Diseño de 44m ² | CDG | París | Disney | Astérix,"Alojamiento entero: piso en Gonesse, Francia",71,Anfitrión: Mike,"4,94",,paris
Apartamento luminoso cerca de la plaza Léon Blum,"Alojamiento entero: piso en París, Francia",180,Anfitrión: Philippe,"4,96",25,paris
"Boisseau, 1Ch/1Sdb, 2 personas","Alojamiento entero: piso en París, Francia",220,Anfitrión: Ludovic,,,paris
Diseño de 44m ² | CDG | París | Disney | Astérix,"Alojamiento entero: piso en Gonesse, Francia",71,Anfitrión: Mike,"4,94",,paris
Apartamento luminoso cerca de la plaza Léon Blum,"Alojamiento entero: piso en París, Francia",180,Anfitrión: Philippe,"4,96",25,paris
Apartamento elegante en París y terraza,"Alojamiento entero: piso en París, Francia",160,Anfitrión: Patrick,,,paris
Acogedor T2 con balcón -RER B/París,"Alojamiento entero: piso en Bagneux, Francia",70,Anfitrión: Tanedice,"4,90",10,paris
Loft 52m²+estacionamiento a 15 min del centro de París,"Alojamiento entero: piso en Les Lilas, Francia",91,Anfitrión: Lorenzo,"4,99",,paris
Apartamento 1 BR con balcón - Chatelet/ París 2,"Alojamiento entero: piso en Paris 2e, Francia",247,Anfitrión: Xiaoling,"4,81",132,paris
Luxueux 60m² central de Beaubourg,"Alojamiento entero: piso en París, Francia",220,Anfitrión: Merci Alice,,,paris
Apartamento de 2 habitaciones luminoso,"Alojamiento entero: piso en París, Francia",140,Anfitrión: Annabelle,,,paris
LE MARAIS - NUEVO APARTAMENTO DE ALTA GAMA,"Alojamiento entero: piso en París, Francia",179,Anfitrión: Valery,"4,55",121,paris
Loft chic vintage Paris center,"Alojamiento entero: piso en París, Francia",182,Anfitrión: Guillemette,"4,78",27,paris
Maison Bůoise 1BR/3P con AC en los Campos Elíseos,"Alojamiento entero: piso en París, Francia",205,Anfitrión: Cozy BnB,"4,92",62,paris
Magnífico Apartamento 1BR/4P - Montorgueil 4,"Alojamiento entero: piso en París, Francia",214,Anfitrión: Alex,"4,60",,paris
Precioso apartamento en el corazón del distrito 16,"Alojamiento entero: piso en París, Francia",187,Anfitrión: Checkmyguest,"4,55",,paris
Hermosa vista estudio París 17,"Alojamiento entero: piso en París, Francia",90,Anfitrión: Céline,,,paris
